snapshot_date,snapshot_url,snippet
20231209224953,http://web.archive.org/web/20231209224953/https://www.nbcsports.com/fantasy/football/player-news,"Here we go again with Watson. Watson missed the first three games of the season with a hamstring injury and was finally starting to come into his own for the Packers this year. It is unclear how long his most recent soft tissue injury will keep him out of the lineup, which is particularly concerning for the organization now that they have played themselves into playoff contention during the second half of the season. The result of the team’s Week 14 game against the Giants is likely to play a role in how cautious they can be with their second-year wide receiver."
20231209224953,http://web.archive.org/web/20231209224953/https://www.nbcsports.com/fantasy/football/player-news,"Campbell popped on the team’s injury report on Saturday, making it unlikely he suits up for Monday Night Football against the Packers. He had seen a reduced role of late while playing behind five other wide receivers, meaning his absence is unlikely to mean much to the rotation of pass-catchers for the Giants."
20231217000520,http://web.archive.org/web/20231217000520/https://www.nbcsports.com/fantasy/football/player-news,"Moss scored the first touchdown for the Colts but suffered an arm injury on a horse collar tackle on the score. It’s the same arm that the veteran back broke in the preseason. Moss was ruled as questionable to return, managing 13 yards on four carries and catching three passes for 20 yards and a touchdown prior to departing."
20231231022626,http://web.archive.org/web/20231231022626/https://www.nbcsports.com/fantasy/football/player-news,"This wouldn’t seem like massive news if taken without the context of the current state of the Denver wide receiver room. Courtland Sutton has been ruled out with a concussion, Jerry Jeudy is questionable with illness, and rookie Marvin Mims is questionable with a hamstring injury. The fact that the team added two wide receivers to the active roster the day before the game seems to hint at the possibility they are planning to be without both Jeudy and Mims. Final word will come when the team releases their Week 17 inactives ahead of their late afternoon kickoff against the Chargers."
20240101040516,http://web.archive.org/web/20240101040516/https://www.nbcsports.com/fantasy/football/player-news,"Reed had a spectacular first half, catching 6-of-8 targets for 89 yards and two touchdowns before being deemed questionable to return with a chest injury in the second half. Reed came into the contest listed as questionable with toe and chest injuries so it appears to be an aggravation of the existing injury."
20240116010933,http://web.archive.org/web/20240116010933/https://www.nbcsports.com/fantasy/football/player-news,"Mayfield came into the contest listed questionable with multiple injuries after struggling through the team’s Week 18 win over the Panthers. Inactive for the Buccaneers are WR Rakim Jarrett, RB Patrick Laird, LB Jose Ramirez, LB J.J. Russell,O T Brandon Walton, LB Markees Watts, and QB John Wolford."
20240312022303,http://web.archive.org/web/20240312022303/https://www.nbcsports.com/fantasy/football/player-news,"NFL Network’s Mike Garafolo broke the news and it was quickly followed up with a report of Joe Mixon’s release. Per Garafolo, the deal includes $4.3 million in the first year. Moss signed with the Colts as a backup last year and even missed Week 1 because of an arm injury. With Jonathan Taylor on the PUP list, Moss was granted the starting role in Week 2 and ran with it, amassing 96 carries for 466 yards and four scores over the next five weeks. He would even remain relevant with Taylor active, forcing a committee for a few more weeks before Taylor slowly took over the backfield. With Mixon out of the picture in Cincinnati, Moss will slot in as the top option in the backfield. Chase Brown, who broke off some explosive plays as a rookie, should still see plenty of carries while also handling the bulk of the passing downs snaps. As the likely goal line back for a high-powered offense, Moss will project for RB2 fantasy numbers if his new team doesn’t make any other additions at running back."
20240401001628,http://web.archive.org/web/20240401001628/https://www.nbcsports.com/fantasy/football/player-news,"Williams didn’t play a snap of regular-season football in 2023 after an ankle injury that sidelined him in training camp ultimately required surgery to correct. Now, the soon-to-be 33-year-old vet is cleared and looking to return to the field. Williams started in eight of the 14 games he appeared in for the Broncos in 2022, totaling 44 tackles and one interception while breaking up seven passes. According to the Denver Gazette’s Chris Tomasson, Williams has spoken with teams, but will likely wait until after the NFL Draft to decide on where to sign."
20240418173339,http://web.archive.org/web/20240418173339/https://www.nbcsports.com/fantasy/football/player-news,"Giants coaches and front office officials have done their due diligence on this year’s crop of quarterbacks with Daniel Jones coming off a torn ACL and having missed significant time with a troublesome neck injury. The game-managing Nix has seen his draft stock rise in recent weeks and could land with a QB-needy team in the first round. The Giants likely won’t use their sixth overall pick on Nix, but could trade down and take him late in the first round. That would set up Nix for a training camp competition with Jones. Giants owner John Mara said last month that he wouldn’t stop the front office from taking a quarterback in the draft."
20240618154947,http://web.archive.org/web/20240618154947/https://www.nbcsports.com/fantasy/football/player-news,"This one shouldn’t come as much of a surprise. Thornton, a former second-round pick of the Patriots in 2022, has been slowed by injuries and offered little offense upside when healthy. Through 22 career games, he’s caught just 35 passes for 338 yards and two scores, with most of that production coming in his rookie season. In addition to playing under a new coaching staff, Thornton is also set to compete against rookies Ja’Lynn Polk and Javon Baker. Polk is already locked into a roster spot as a second-round pick, and the Patriots used a fourth-round pick on Baker, which should all but secure his spot. Outside of one or two depth options, the Patriots’ wide receiver room feels fairly in place. It may take a camp injury or two for Thornton to stick on the roster come cut day."
20240619005952,http://web.archive.org/web/20240619005952/https://www.nbcsports.com/fantasy/football/player-news,"This one shouldn’t come as much of a surprise. Thornton, a former second-round pick of the Patriots in 2022, has been slowed by injuries and offered little offense upside when healthy. Through 22 career games, he’s caught just 35 passes for 338 yards and two scores, with most of that production coming in his rookie season. In addition to playing under a new coaching staff, Thornton is also set to compete against rookies Ja’Lynn Polk and Javon Baker. Polk is already locked into a roster spot as a second-round pick, and the Patriots used a fourth-round pick on Baker, which should all but secure his spot. Outside of one or two depth options, the Patriots’ wide receiver room feels fairly in place. It may take a camp injury or two for Thornton to stick on the roster come cut day."
20240312022303,http://web.archive.org/web/20240312022303/https://www.nbcsports.com/fantasy/football/player-news,"NFL Network’s Mike Garafolo broke the news and it was quickly followed up with a report of Joe Mixon’s release. Per Garafolo, the deal includes $4.3 million in the first year. Moss signed with the Colts as a backup last year and even missed Week 1 because of an arm injury. With Jonathan Taylor on the PUP list, Moss was granted the starting role in Week 2 and ran with it, amassing 96 carries for 466 yards and four scores over the next five weeks. He would even remain relevant with Taylor active, forcing a committee for a few more weeks before Taylor slowly took over the backfield. With Mixon out of the picture in Cincinnati, Moss will slot in as the top option in the backfield. Chase Brown, who broke off some explosive plays as a rookie, should still see plenty of carries while also handling the bulk of the passing downs snaps. As the likely goal line back for a high-powered offense, Moss will project for RB2 fantasy numbers if his new team doesn’t make any other additions at running back."
20240401001628,http://web.archive.org/web/20240401001628/https://www.nbcsports.com/fantasy/football/player-news,"Williams didn’t play a snap of regular-season football in 2023 after an ankle injury that sidelined him in training camp ultimately required surgery to correct. Now, the soon-to-be 33-year-old vet is cleared and looking to return to the field. Williams started in eight of the 14 games he appeared in for the Broncos in 2022, totaling 44 tackles and one interception while breaking up seven passes. According to the Denver Gazette’s Chris Tomasson, Williams has spoken with teams, but will likely wait until after the NFL Draft to decide on where to sign."
20240501143855,http://web.archive.org/web/20240501143855/https://www.nbcsports.com/fantasy/football/player-news,"Oweh, a former first round pick, is now locked up until the end of the 2025 season. Pro Football Focus graded Oweh as the league’s 30th best EDGE in 2023, as he had nine QB hits and 40 QB hurries in an injury-shortened campaign. He has at least five sacks in each of his three seasons with Baltimore. PFF graded the Ravens as the seventh best pass-rushing defense in 2023."
20240515005949,http://web.archive.org/web/20240515005949/https://www.nbcsports.com/fantasy/football/player-news,"All was selected in the fourth round with the 115th overall pick out of the University of Iowa. While he spent his final collegiate season with the Hawkeyes, he played four seasons at Michigan, with 40 career games and 19 starts. Over that time he caught 75 passes for 864 yards and five TDs. However, All tore the ACL eight games into the 2023 season and is still six months into his recovery, which he’s doing at the Bengals’ facility. “I’m feeling good,” All said about recovery. “Every day I’m feeling good. I’m just ready to attack physical therapy and get back to you know, playing. I feel great. I move great. It’s just a matter of time because things are still healing in there.” It’s unlikely All makes an impact in 2024 given his injury and how hard the transition to the NFL can be for tight ends."
20240526131407,http://web.archive.org/web/20240526131407/https://www.nbcsports.com/fantasy/football/player-news,"The departure of Michael Gallup this offseason immediately opened the door for Tolbert to step into a bigger role. Couple that with the fact that the Cowboys didn’t take a receiver until the sixth round of the draft, and his path to snaps becomes all the more clear. Archer reports that Tolbert has “joined [Dak] Prescott at the hip” this offseason, spending additional time with Prescott in hopes of developing additional familiarity and trust with the quarterback come game day. Head coach Mike McCarthy also praised Tolbert’s growth, saying he’s “taken leaps and bounds” with his confidence and understanding of the game. Tolbert entered the league as a third-round pick out of South Alabama and turned in a solid combine, posting an 8.76 RAS. He’s played sparingly through his first two years in the league, amassing 24 receptions for 280 yards and two touchdowns for his career, and has likely faced a steep learning curve going from the Sun Belt conference to the NFL. Any significant role would make him an interesting dart throw in the later rounds of fantasy drafts, as an injury to either Cooks or Lamb could thrust Tolbert into a starting role."
20240526221517,http://web.archive.org/web/20240526221517/https://www.nbcsports.com/fantasy/football/player-news,"Whether or not Rodgers’ affinity for Corley translates to success in Corley’s rookie season is to be determined, but it’s high praise coming from Rodgers, who is known for latching on to certain receivers. Garrett Wilson will be the unquestioned WR1 in the Jets’ offense this season, but Corley’s ability to succeed in the short areas of the field and create after the catch could open him up for ample opportunity in his first season. Rodgers also said of Corley that he “really felt like [Corley] was going to fit in with what [the Jets] are trying to do” this upcoming season. The addition of Mike Williams only adds to the competition Corley will face for targets, but his skill set is such that he could be a weekly factor even if Williams and Wilson are seeing the majority of targets further down field. An injury to either receiver would immediately raise Corley’s fantasy ceiling."
20240526221517,http://web.archive.org/web/20240526221517/https://www.nbcsports.com/fantasy/football/player-news,"The departure of Michael Gallup this offseason immediately opened the door for Tolbert to step into a bigger role. Couple that with the fact that the Cowboys didn’t take a receiver until the sixth round of the draft, and his path to snaps becomes all the more clear. Archer reports that Tolbert has “joined [Dak] Prescott at the hip” this offseason, spending additional time with Prescott in hopes of developing additional familiarity and trust with the quarterback come game day. Head coach Mike McCarthy also praised Tolbert’s growth, saying he’s “taken leaps and bounds” with his confidence and understanding of the game. Tolbert entered the league as a third-round pick out of South Alabama and turned in a solid combine, posting an 8.76 RAS. He’s played sparingly through his first two years in the league, amassing 24 receptions for 280 yards and two touchdowns for his career, and has likely faced a steep learning curve going from the Sun Belt conference to the NFL. Any significant role would make him an interesting dart throw in the later rounds of fantasy drafts, as an injury to either Cooks or Lamb could thrust Tolbert into a starting role."
20240530035102,http://web.archive.org/web/20240530035102/https://www.nbcsports.com/fantasy/football/player-news,"Kittle told reporters he played through the injury around Week 9 or 10 and played through it for the remainder of the season. He has been out of commission for OTAs but wasn’t concerned about his availability for camp, saying his recovery is on schedule. Kittle topped 1,000 yards for the third time in his career and caught 65 passes despite the injury. He didn’t miss any games outside of the rest week all San Francisco starters got in Week 18. Though his production remains streaky, Kittle showed no signs of slowing in 2023 and remains in the middle of the TE1 pack."
20240530035102,http://web.archive.org/web/20240530035102/https://www.nbcsports.com/fantasy/football/player-news,"Jacobs missed the first week of OTAs with a hamstring issue but was back for individual drills this week. He was seen cutting and running during individual work and looked perfectly healthy. His light workload to start OTAs is almost certainly a precaution and nothing more. Assuming Jacobs is a full go in practice next week, the hamstring issue will be a non-story by training camp. Projected to easily lead an ascending Green Bay offense in carries, Jacobs is rightfully being drafted as a low-end RB1 to start the summer."
20240531005534,http://web.archive.org/web/20240531005534/https://www.nbcsports.com/fantasy/football/player-news,"Odunze was sidelined with a hamstring injury during the first round of OTAs but was seen on video catching a deep pass from Caleb Williams in what appeared to be 7-on-7 drills. Odunze will be battling for targets in a wide receiver room that features veterans Keenan Allen and DJ Moore but could contribute immediately as a deep threat — something he specialized in during his days at Washington. As far as fantasy is concerned, Odunze’s rookie ceiling could be capped by the presence of Allen and Moore, but he should be good for a few splash weeks, making him an enticing pick in best ball drafts."
20240628044846,http://web.archive.org/web/20240628044846/https://www.nbcsports.com/fantasy/football/player-news,"The Rams added Corum to a backfield dominated by Williams last season. Williams has been dealing with a foot issue in the offseason while Corum has been asked to develop a three-down skillset. The two backs could complement each other in the Rams offense. It is most notable that Williams said Corum’s addition as a runner could help him showcase even more as a pass-catcher after catching 32 passes for 206 yards last season. Though Corum’s addition has Williams optimistically thinking about their complementary roles, Williams has a notable injury history and is a risky gamble at cost for fantasy football with the added competition for touches. Corum will see the field next season, but expect Williams to be the lead back. If his comments are any indication, Williams’ pass-catching upside could see a bump for 2024."
20240628044846,http://web.archive.org/web/20240628044846/https://www.nbcsports.com/fantasy/football/player-news,"ESPN’s Marc Raimondi reported McCloud, a journeyman entering his seventh NFL season, “performed well” in three-wideout sets during minicamp, connecting with Kirk Cousins for several big plays. Atlanta’s receiver room, as recently noted by Rotoworld’s Patrick Daugherty , is ominously thin entering the regular season. An injury to Darnell Mooney or Drake London could open up a starting role for McCloud — traditionally a kicker returner — in what will be a pass-first Falcons offense. He had 36 catches for 379 yards in two seasons with the 49ers before signing with the Falcons this spring."
20240628073456,http://web.archive.org/web/20240628073456/https://www.nbcsports.com/fantasy/football/player-news,"The Rams added Corum to a backfield dominated by Williams last season. Williams has been dealing with a foot issue in the offseason while Corum has been asked to develop a three-down skillset. The two backs could complement each other in the Rams offense. It is most notable that Williams said Corum’s addition as a runner could help him showcase even more as a pass-catcher after catching 32 passes for 206 yards last season. Though Corum’s addition has Williams optimistically thinking about their complementary roles, Williams has a notable injury history and is a risky gamble at cost for fantasy football with the added competition for touches. Corum will see the field next season, but expect Williams to be the lead back. If his comments are any indication, Williams’ pass-catching upside could see a bump for 2024."
20240628073456,http://web.archive.org/web/20240628073456/https://www.nbcsports.com/fantasy/football/player-news,"ESPN’s Marc Raimondi reported McCloud, a journeyman entering his seventh NFL season, “performed well” in three-wideout sets during minicamp, connecting with Kirk Cousins for several big plays. Atlanta’s receiver room, as recently noted by Rotoworld’s Patrick Daugherty , is ominously thin entering the regular season. An injury to Darnell Mooney or Drake London could open up a starting role for McCloud — traditionally a kicker returner — in what will be a pass-first Falcons offense. He had 36 catches for 379 yards in two seasons with the 49ers before signing with the Falcons this spring."
20240628100213,http://web.archive.org/web/20240628100213/https://www.nbcsports.com/fantasy/football/player-news,"The Rams added Corum to a backfield dominated by Williams last season. Williams has been dealing with a foot issue in the offseason while Corum has been asked to develop a three-down skillset. The two backs could complement each other in the Rams offense. It is most notable that Williams said Corum’s addition as a runner could help him showcase even more as a pass-catcher after catching 32 passes for 206 yards last season. Though Corum’s addition has Williams optimistically thinking about their complementary roles, Williams has a notable injury history and is a risky gamble at cost for fantasy football with the added competition for touches. Corum will see the field next season, but expect Williams to be the lead back. If his comments are any indication, Williams’ pass-catching upside could see a bump for 2024."
20240628100213,http://web.archive.org/web/20240628100213/https://www.nbcsports.com/fantasy/football/player-news,"ESPN’s Marc Raimondi reported McCloud, a journeyman entering his seventh NFL season, “performed well” in three-wideout sets during minicamp, connecting with Kirk Cousins for several big plays. Atlanta’s receiver room, as recently noted by Rotoworld’s Patrick Daugherty , is ominously thin entering the regular season. An injury to Darnell Mooney or Drake London could open up a starting role for McCloud — traditionally a kicker returner — in what will be a pass-first Falcons offense. He had 36 catches for 379 yards in two seasons with the 49ers before signing with the Falcons this spring."
20240705055445,http://web.archive.org/web/20240705055445/https://www.nbcsports.com/fantasy/football/player-news,"The update comes passively from team reporter Stu Jackson, who mentions that Higbee’s return-to-play date remains unknown. Isolated ACL tears typically require at least nine months of rehabilitation and Higbee’s combination ACL/MCL injury occurred on January 14th. The PUP list’s minimum four-game stay makes sense. GM Les Snead signed free agent TE Colby Parkinson to a three-year, $22.5 million deal this offseason, ostensibly giving him the first crack at replacing Higbee as the team’s Week 1 starter. Parkinson never earned a full-time role with the Seahawks but tallied 15 explosive pass plays (15-plus yards) as a backup over the last two years."
20240705055445,http://web.archive.org/web/20240705055445/https://www.nbcsports.com/fantasy/football/player-news,"The Arizona coaching staff, Venerable said, “loves” Conner and his tough running and veteran leadership. “The best version of this offense last year ran through [Conner],” Venerable said during an interview with Rotoworld’s Patrick Daugherty and Denny Carter . “James Conner is one of their best players.” Venerable suggested Michael Carter could mix in behind Conner, rather than rookie RB Trey Benson functioning as the clear RB2. Benson, the 66th pick in the 2024 NFL Draft, is considered an explosive back, though he never had more than 20 rushing attempts in a single game during his college career. We would expect Benson to be the Cardinals’ lead back should the 29-year-old Conner once again miss time with injury in 2024."
20240705203732,http://web.archive.org/web/20240705203732/https://www.nbcsports.com/fantasy/football/player-news,"The update comes passively from team reporter Stu Jackson, who mentions that Higbee’s return-to-play date remains unknown. Isolated ACL tears typically require at least nine months of rehabilitation and Higbee’s combination ACL/MCL injury occurred on January 14th. The PUP list’s minimum four-game stay makes sense. GM Les Snead signed free agent TE Colby Parkinson to a three-year, $22.5 million deal this offseason, ostensibly giving him the first crack at replacing Higbee as the team’s Week 1 starter. Parkinson never earned a full-time role with the Seahawks but tallied 15 explosive pass plays (15-plus yards) as a backup over the last two years."
20240705203732,http://web.archive.org/web/20240705203732/https://www.nbcsports.com/fantasy/football/player-news,"The Arizona coaching staff, Venerable said, “loves” Conner and his tough running and veteran leadership. “The best version of this offense last year ran through [Conner],” Venerable said during an interview with Rotoworld’s Patrick Daugherty and Denny Carter . “James Conner is one of their best players.” Venerable suggested Michael Carter could mix in behind Conner, rather than rookie RB Trey Benson functioning as the clear RB2. Benson, the 66th pick in the 2024 NFL Draft, is considered an explosive back, though he never had more than 20 rushing attempts in a single game during his college career. We would expect Benson to be the Cardinals’ lead back should the 29-year-old Conner once again miss time with injury in 2024."
20240713092815,http://web.archive.org/web/20240713092815/https://www.nbcsports.com/fantasy/football/player-news,"Graff notes that this may be dependent on whether or not Kendrick Bourne (knee) needs more time to recover from his torn ACL. However, he also says Polk was “a steady, reliable target in minicamp” as the rookie worked in more with the first-team offense. The Patriots drafted Polk with the No. 37 overall pick in this year’s draft. The former Washington Husky totaled 69 receptions for 1,159 and nine touchdowns in his final college season, and while it sounds like his impact in 2024 is somewhat contingent on when Bourne returns, it’s worth noting that the Patriots have one of the worst receiver rooms in the league. It’s possible Polk shows enough in camp to earn a significant role regardless of Bourne’s availability, which could set the stage for a strong rookie season. With that said, expectations should be tempered, as the Patriots have a long way to go before becoming a high-end offense for fantasy purposes."
